Model,Accuracy,AUC (macro),Sensitivity,Specificity,ECE,EOD (age_group),DP (age_group),EOD (sex),DP (sex),EOD (loc_zone),DP (loc_zone)
Model A Standard Baseline,0.8596,0.9836,0.7648,0.9565,0.0192,0.3404,0.1045,0.084,0.0319,0.68,0.0773
Model B Sampling Only,0.7917,0.9475,0.5865,0.9376,0.0585,0.0318,0.069,0.0361,0.0037,0.3438,0.0782
Model C Reweighting Only,0.6411,0.8803,0.5736,0.9313,0.0937,0.0505,0.0322,0.1201,0.0175,0.3939,0.0758
Model D cGAN Only,0.8046,0.9535,0.6371,0.9386,0.0634,0.0484,0.0728,0.0285,0.0132,0.4062,0.0894
Model E Full Framework,0.7327,0.9276,0.6081,0.9396,0.0543,0.0299,0.0658,0.0129,0.0058,0.3467,0.0894
